{
  "schemaVersion": "1.0.0",
  "reviewMetadata": {
    "reviewedAt": "2025-10-13T19:45:00Z",
    "reviewedBy": "Claude Sonnet 4.5 (Dummy-Mode)",
    "inputFiles": [
      "output-phase0.5a-topics.json",
      "output-phase0.5b-topic-1-chapters.json",
      "output-phase0.5b-topic-2-chapters.json",
      "output-phase0.5b-topic-3-chapters.json"
    ],
    "isDummyReview": true
  },
  "overallAssessment": {
    "completeness": "EXCELLENT",
    "balance": "EXCELLENT",
    "coherence": "EXCELLENT",
    "overallScore": 100,
    "recommendation": "APPROVE"
  },
  "detailedFindings": {
    "gaps": [],
    "redundancies": [],
    "inconsistencies": [],
    "crossTopicConnections": []
  },
  "statisticalAnalysis": {
    "totalTopics": 3,
    "totalChapters": 15,
    "totalEstimatedSections": 76,
    "averageChaptersPerTopic": 5.0,
    "averageSectionsPerChapter": 5.1,
    "topicSizeDistribution": {
      "topic-1": 33,
      "topic-2": 28,
      "topic-3": 15
    },
    "difficultyDistribution": {
      "Beginner": 7,
      "Intermediate": 6,
      "Advanced": 2
    }
  },
  "recommendations": [
    {
      "priority": "LOW",
      "category": "OTHER",
      "recommendation": "DUMMY-MODE: Keine Empfehlungen. Alle Inputs wurden als optimal bewertet.",
      "estimatedEffort": "MINOR"
    }
  ]
}
