{
  "schemaVersion": "1.0.0",
  "reviewMetadata": {
    "reviewedAt": "2025-10-13T19:50:00Z",
    "reviewedBy": "Claude Sonnet 4.5",
    "inputFiles": [
      "output-phase0.5a-topics.json",
      "output-phase0.5b-topic-1-chapters.json",
      "output-phase0.5b-topic-2-chapters.json",
      "output-phase0.5b-topic-3-chapters.json"
    ],
    "isDummyReview": false
  },
  "overallAssessment": {
    "completeness": "GOOD",
    "balance": "ACCEPTABLE",
    "coherence": "GOOD",
    "overallScore": 78,
    "recommendation": "MINOR_REVISIONS"
  },
  "detailedFindings": {
    "gaps": [
      {
        "location": "topic-2",
        "issue": "Kein Chapter zu 'Häufige Export-Fehler beheben'",
        "severity": "MEDIUM",
        "suggestion": "Chapter 2-7 ergänzen: 'Export-Troubleshooting'. Behandelt: 'Export hängt', 'Report leer', 'Fehlende Artifacts im Export'.",
        "affectedLearningObjectives": [
          "Ermittler können Export-Fehler selbstständig beheben"
        ]
      },
      {
        "location": "chapter-1-1",
        "issue": "Installation wird erwähnt, aber keine Lizenzierungs-Anleitung",
        "severity": "LOW",
        "suggestion": "Section 'AXIOM Examine lizenzieren' in Chapter 1-1 ergänzen (oder in separates Chapter 1-0 'Vorbereitung').",
        "affectedLearningObjectives": []
      }
    ],
    "redundancies": [
      {
        "locations": ["chapter-1-2", "chapter-1-5"],
        "overlap": "Beide Chapters behandeln 'Metadaten validieren'",
        "severity": "LOW",
        "suggestion": "Klarer abgrenzen: Chapter 1-2 = Metadaten ERFASSEN (beim Anlegen), Chapter 1-5 = Metadaten PRÜFEN (vor Analyse-Start). Eventuell: Chapter 1-2 nur Erfassung, Chapter 1-5 nur Checkliste."
      }
    ],
    "inconsistencies": [
      {
        "type": "TERMINOLOGY",
        "locations": ["chapter-1-3", "chapter-2-1"],
        "issue": "Chapter 1-3 verwendet 'Evidenzquelle', Chapter 2-1 verwendet 'Datenquelle'",
        "severity": "MEDIUM",
        "suggestion": "Einheitlich 'Evidenzquelle' verwenden (gemäß Terminologie-Entscheidungsliste). In Chapter 2-1 korrigieren."
      },
      {
        "type": "DIFFICULTY",
        "locations": ["chapter-1-1", "chapter-1-3"],
        "issue": "Chapter 1-1 = 'Beginner', Chapter 1-3 = 'Intermediate'. Aber Chapter 1-3 folgt direkt auf 1-1. Ist der Schwierigkeitssprung zu groß?",
        "severity": "LOW",
        "suggestion": "Eventuell Zwischenschritt: Chapter 1-2 = 'Beginner', dann Chapter 1-3 = 'Intermediate'. Oder: Chapter 1-3 auch als 'Beginner' einstufen (mit mehr Erklärungen)."
      }
    ],
    "crossTopicConnections": [
      {
        "fromLocation": "chapter-1-2",
        "toLocation": "topic-3",
        "reason": "Case-Erstellung kann fehlschlagen → Troubleshooting",
        "confidence": "HIGH",
        "status": "CONFIRMED",
        "suggestedInPhase": "Phase 0.5d"
      },
      {
        "fromLocation": "chapter-1-3",
        "toLocation": "topic-2",
        "reason": "Evidence-Import erzeugt Metadaten → relevant für Export",
        "confidence": "MEDIUM",
        "status": "CONFIRMED",
        "suggestedInPhase": "Phase 0.5d"
      },
      {
        "fromLocation": "chapter-2-5",
        "toLocation": "chapter-3-2",
        "reason": "Export-Fehler (Chapter 2-5) werden in Troubleshooting (Chapter 3-2) behandelt",
        "confidence": "HIGH",
        "status": "NEW",
        "suggestedInPhase": "Phase 0.5d"
      }
    ]
  },
  "statisticalAnalysis": {
    "totalTopics": 3,
    "totalChapters": 15,
    "totalEstimatedSections": 76,
    "averageChaptersPerTopic": 5.0,
    "averageSectionsPerChapter": 5.1,
    "topicSizeDistribution": {
      "topic-1": 33,
      "topic-2": 28,
      "topic-3": 15
    },
    "difficultyDistribution": {
      "Beginner": 7,
      "Intermediate": 6,
      "Advanced": 2
    }
  },
  "recommendations": [
    {
      "priority": "MEDIUM",
      "category": "GAP",
      "recommendation": "Chapter 2-7 'Export-Troubleshooting' ergänzen. Aktuell fehlt Fehlerbehandlung für Export.",
      "estimatedEffort": "MODERATE"
    },
    {
      "priority": "MEDIUM",
      "category": "INCONSISTENCY",
      "recommendation": "Terminologie vereinheitlichen: 'Evidenzquelle' statt 'Datenquelle' in Chapter 2-1.",
      "estimatedEffort": "MINOR"
    },
    {
      "priority": "LOW",
      "category": "REDUNDANCY",
      "recommendation": "Abgrenzung Chapter 1-2 vs. 1-5 klären (Metadaten ERFASSEN vs. PRÜFEN).",
      "estimatedEffort": "MINOR"
    },
    {
      "priority": "LOW",
      "category": "GAP",
      "recommendation": "Lizenzierungs-Anleitung in Chapter 1-1 ergänzen (oder separates Chapter 1-0).",
      "estimatedEffort": "MINOR"
    }
  ]
}
